pagePath,metaTitle,metaDescription,ogTitle,ogDescription
/,OWOX Data Marts - Self-Service Analytics,Create a data mart library effortlessly and empower your team with intuitive analytics. Get started with OWOX Data Marts today!,Transform Your Analytics with OWOX Data Marts!,Unlock the power of data with OWOX Data Marts. Easily create data libraries and empower your business users. Let's get started!
/apps/backend/modular-conventions/,Modular Monolith Conventions,Explore best practices for structuring modular monolith applications efficiently with OWOX Data Marts.,Master Modular Monolith Conventions with OWOX!,Dive into the essentials of organizing your modular monolith applications effectively. Discover best practices today!
/apps/backend/publishing/,Automated Publishing Guide | OWOX Data Marts,Discover how to automate the publishing process for OWOX Data Marts Backend package with our detailed guide.,Master the Automated Publishing Process!,"Join us as we explore the automated publishing process for OWOX Data Marts. Get insights, tips, and steps to streamline your development!"
/apps/backend/readme/,Backend Architecture Guidelines | OWOX,"Explore essential guidelines for structuring and organizing your backend application using NestJS, TypeORM, and clean layering principles.",Master Backend Architecture with OWOX Guidelines,"Discover how to effectively structure your backend application with our detailed guidelines on NestJS, TypeORM, and clean layering principles!"
/apps/backend/src/common/scheduler/readme/,Scheduler Module | OWOX Data Marts,"Discover the Scheduler Module for managing time-based triggers efficiently. Flexible, extensible, and easy to integrate for all your scheduling needs.",Enhance Your Scheduling with OWOX Data Marts' Scheduler Module!,"Looking to manage time-based triggers effortlessly? Explore the Scheduler Module, your flexible and extensible solution for efficient scheduling!"
/apps/backend/src/data-marts/data-destination-types/ee/email/readme/,Email Destination Notes | OWOX Data Marts,"Transitional implementation notes for the Email destination in OWOX Data Marts and the shared logic behind Slack, Teams, and Google Chat.",Inside the Email Destination,"A short technical note on how the Email destination currently shares logic with Slack, MS Teams, and Google Chat in OWOX Data Marts."
/apps/backend/src/data-marts/data-destination-types/ee/readme/,Enterprise Edition Notice | OWOX Data Marts,Licensing requirements for Enterprise Edition code in OWOX Data Marts destination types. A valid EE license and license key are required.,OWOX Data Marts Enterprise Edition Notice,This directory holds Enterprise Edition code — learn what an EE license covers and how enforcement works in OWOX Data Marts.
/apps/backend/src/ee/readme/,EE Licensing Requirements | OWOX Data Marts,"Enterprise Edition notice for OWOX Data Marts backend code: usage restrictions, license enforcement, and how to obtain an EE license key.","Enterprise Edition Code, Explained","What the EE directory contains, why it's license-gated, and what you need to run Enterprise features in OWOX Data Marts."
/apps/backend/src/migrations/readme/,OWOX Data Marts Migration Guidelines,Learn essential migration guidelines for OWOX Data Marts. Ensure smooth database transitions and consistency with best practices.,Master Database Migrations with OWOX Data Marts!,Dive into our migration guidelines for OWOX Data Marts. Ensure your database changes are smooth and consistent with our expert tips!
/apps/backend/test/integration/readme/,Database Integration Tests | OWOX Data Marts,"Real-database integration tests for OWOX Data Marts: validating BigQuery, Athena, and other storage adapters against live cloud APIs.",Testing Against Real Cloud Databases,"Mocks can't catch everything. See how OWOX Data Marts validates storage adapters against live BigQuery, Athena, and more!"
/apps/backend/test/readme/,Backend Test Suite | OWOX Data Marts,"Explore the OWOX Data Marts backend test directory: API E2E tests with Jest and Supertest, plus real-database integration test configuration.",How the Backend Is Tested,"API E2E tests, custom Jest configs, and integration setups — a quick tour of the OWOX Data Marts backend test directory."
/apps/ctl/readme/,@owox/ctl Package | OWOX Data Marts,"Install and use @owox/ctl, the OWOX Data Marts Control CLI for scripts, CI jobs, and AI agents. Commands, credentials, and JSON output.",The CLI That Controls OWOX Data Marts,"npm install -g @owox/ctl and control your OWOX Data Marts deployment from any terminal, pipeline, or AI agent. Here's how!"
/apps/docs/readme/,OWOX Data Marts Documentation,Explore the comprehensive documentation for OWOX Data Marts. Get started quickly and optimize your data management effortlessly.,Unlock Your Data Potential with OWOX Data Marts Documentation,"Dive into the OWOX Data Marts documentation. Whether you're starting or optimizing your data flow, we've got you covered!"
/apps/owox/contributing/,Contributing & Advanced Usage | OWOX Data Marts,Explore how to contribute and utilize advanced features of OWOX Data Marts. Perfect for developers looking to customize their experience.,Join Us: Contributing & Advanced Usage of OWOX Data Marts,Dive into the world of OWOX Data Marts! Learn how to contribute and leverage advanced features for an enhanced data experience.
/apps/owox/publishing/,Publishing OWOX Data Marts CLI,"Learn about the automated publishing process for OWOX Data Marts CLI to npm, including scripts and package contents.",Master the Publishing Process of OWOX Data Marts CLI!,Dive into the automated publishing process for the OWOX Data Marts CLI package and discover valuable insights on setup and package contents.
/apps/owox/readme/,OWOX Data Marts - Open-Source Analytics,Empower your data analytics with OWOX Data Marts. Explore our open-source platform for seamless self-service analytics.,Transform Your Analytics with OWOX Data Marts!,Unlock your analytics potential with OWOX Data Marts. Dive into our open-source solution for a hassle-free self-service experience!
/apps/owox/src/web/readme/,Web Static Assets Utility | OWOX,Easily configure your Express app to serve static web assets with optimized caching and SPA support using OWOX Data Marts.,Enhance Your Express App with OWOX Static Assets Utility,"Discover how to effortlessly set up and serve static web files in your Express application, ensuring a smooth and optimized user experience."
/apps/web/e2e/readme/,Browser E2E Tests | OWOX Data Marts,Playwright browser E2E tests for OWOX Data Marts: full-stack UI workflows validated in Chromium against the running backend and frontend.,Playwright Tests for the OWOX Web App,"Real browser, real stack — see how OWOX Data Marts validates user-facing flows end to end with Playwright browser tests."
/apps/web/readme/,OWOX Data Marts: Web Application,"Explore the OWOX Data Marts web application, an open-source tool designed for Data Analysts to manage data efficiently. Get started now!",Discover the OWOX Data Marts Web Application!,"Dive into the OWOX Data Marts web application, your go-to open-source solution for Data Analysts seeking to manage data with ease. Let’s get you started!"
/docs/api/,API Access | OWOX Data Marts,"Connect external tools, scripts, and AI agents to OWOX Data Marts via API keys, the owox-ctl CLI, the TypeScript client, or the OpenAPI spec.",Automate OWOX Data Marts via API,"Explore every way to access the OWOX Data Marts API — keys, CLI, TypeScript client, and Swagger UI. Pick your integration path and start building!"
/docs/api/api-client/,TypeScript API Client | OWOX Data Marts,"Use @owox/api-client to call the OWOX Data Marts API from TypeScript or JavaScript. Install, authenticate with an API key, and query data marts.",Build with the OWOX Data Marts API Client,"Integrate OWOX Data Marts into your scripts and tools with @owox/api-client. Quick install, simple auth, full API coverage. Start coding!"
/docs/api/api-keys/,API Keys | OWOX Data Marts,"Create and manage API keys to authenticate external tools, CI jobs, and AI agents with OWOX Data Marts. Learn key format, permissions, and storage.",Create Your OWOX Data Marts API Key,"API keys unlock owox-ctl, the API client, and custom integrations. Learn how to create, store, and manage them securely in a few clicks!"
/docs/api/openapi/,OpenAPI & Swagger UI | OWOX Data Marts,"Inspect the OWOX Data Marts HTTP API with OpenAPI specifications and Swagger UI. Find endpoints, schemas, and auth details for direct integrations.",Explore the OWOX Data Marts HTTP API,Prefer raw HTTP? Grab the OpenAPI spec or browse Swagger UI to inspect every endpoint and schema in the OWOX Data Marts API!
/docs/api/owox-ctl/,owox-ctl CLI | OWOX Data Marts,"Control OWOX Data Marts from the terminal with owox-ctl. JSON output for scripts, CI pipelines, and AI agents — install, configure, run commands.",Meet owox-ctl: Data Marts in Your Terminal,"Script it, schedule it, hand it to an AI agent — owox-ctl brings OWOX Data Marts to your terminal with clean JSON output. Get started!"
/docs/changelog/,Changelog | OWOX Data Marts,"Follow the latest OWOX Data Marts releases: new features, improvements, and fixes across the platform, connectors, and integrations.",What's New in OWOX Data Marts,"Stay on top of every OWOX Data Marts release — new features, improvements, and fixes, all in one changelog. See what shipped!"
/docs/contributing/repository/lint-staged-workflow/,Linters | OWOX Data Marts,Explore distributed lint-staged configurations for multi-package monorepos with OWOX Data Marts. Streamline your coding workflow today!,Master Your Code with OWOX Data Marts Linters,Dive into effective lint-staged configurations for your monorepo. OWOX Data Marts can help enhance your development experience effortlessly!
/docs/contributing/repository/release-strategy/,Release & Versioning Strategy | OWOX,"Explore OWOX's structured release and versioning strategy, ensuring API stability and seamless contributor workflow. Learn more now.",Discover OWOX's Release & Versioning Strategy,Dive into the structured release and versioning strategy of OWOX! Ensure API stability and a smooth workflow for contributions. Find out more.
/docs/contributing/repository/repository-structure/,OWOX Data Marts Repository Structure,Explore the organized structure of the OWOX Data Marts monorepo for efficient application and library management.,Discover the OWOX Data Marts Repository Structure!,"Join us as we dive into the well-structured OWOX Data Marts monorepo, designed for seamless application and library management."
/docs/contributing/testing/,Testing Guide | OWOX Data Marts,"Learn the OWOX Data Marts testing strategy: unit, API E2E, browser E2E, and real-database integration tests, with commands and CI triggers.",How OWOX Data Marts Is Tested,From Jest unit tests to Playwright E2E and real BigQuery integration runs — explore the full testing strategy behind OWOX Data Marts!
/docs/destinations/manage-destinations/,Destination Management | OWOX Data Marts,"Manage and configure destinations in OWOX Data Marts, including Google Sheets, Looker Studio, and more. Streamline your data access today!",Manage Your Data Destinations with Ease,Explore how to add and remove destinations like Google Sheets and Looker Studio in OWOX Data Marts. Start optimizing your data access now!
/docs/destinations/supported-destinations/data-studio/,Data Studio Destination | OWOX Data Marts,Connect Data Studio to OWOX Data Marts as a destination. Follow the setup guide to share published Data Marts and build interactive dashboards.,Visualize Data Marts in Data Studio,"Set up Data Studio as a destination, connect your published Data Marts, and start building interactive dashboards on governed data!"
/docs/destinations/supported-destinations/email/,Configure Email Destinations in OWOX,Learn how to set up Email destinations in OWOX Data Marts and deliver scheduled reports and timely data updates straight to any inbox.,Easily Configure Email Destinations in OWOX Data Marts!,Discover the simple steps to set up Email destinations in OWOX Data Marts and keep your team informed with automatic updates!
/docs/destinations/supported-destinations/google-chat/,Google Chat Integration | OWOX Data Marts,Set up Google Chat as a destination in OWOX Data Marts for instant insights. Notify teams seamlessly with automated messages.,Easily Connect Google Chat with OWOX Data Marts!,Discover how to integrate Google Chat as a destination in OWOX Data Marts to keep your team updated with the latest insights effortlessly!
/docs/destinations/supported-destinations/google-sheets/,Google Sheets Integration with OWOX Data Marts,Learn how to set up Google Sheets as a destination in OWOX Data Marts for seamless data access and analysis.,Integrate Google Sheets with OWOX Data Marts!,We're here to guide you on setting up Google Sheets as a destination in OWOX Data Marts. Access and analyze your data with ease!
/docs/destinations/supported-destinations/microsoft-teams/,Microsoft Teams Integration with OWOX Data Marts,Learn to configure Microsoft Teams as a destination in OWOX Data Marts for timely insights and updates.,Enhance Your Workflow with Microsoft Teams Integration!,Discover how to set up Microsoft Teams as a destination in OWOX Data Marts to receive important updates and insights.
/docs/destinations/supported-destinations/slack/,Configure Slack in OWOX Data Marts,Learn how to set up Slack as a destination in OWOX Data Marts and deliver scheduled data insights straight to your team's channels.,Easily Integrate Slack with OWOX Data Marts,Discover the simple steps to configure Slack in OWOX Data Marts and never miss out on important data insights updates!
/docs/editions/agency/,OWOX Data Marts for Agencies,Explore OWOX Data Marts - an open-source analytics platform designed for agencies. Empower client reporting without limits!,Transform Your Agency with OWOX Data Marts,"Discover how OWOX Data Marts can streamline your agency's reporting. No limits, no vendor lock-in, just powerful analytics for your clients!"
/docs/editions/appsscript-edition/,Community Apps Script | OWOX Data Marts,"Unlock the power of Google Sheets with free connectors for marketing and CRM data, giving you full control over your analytics!",Transform Your Data Experience with OWOX Community Apps,Join our community and gain access to free Google Sheets connectors for all your marketing and CRM needs. Total control awaits!
/docs/editions/owox-cloud-editions/,OWOX Cloud Editions - Features & Pricing,"Discover OWOX Cloud Editions, featuring robust data management, AI insights, and flexible pricing. Start your journey today!",Explore OWOX Cloud Editions - Unlock Your Data Potential!,"Dive into the world of OWOX Cloud Editions! Learn about features, security, and pricing tailored for your data needs. Join us now!"
/docs/editions/self-managed-editions/,Self-Managed Editions | OWOX Data Marts,Explore OWOX's Self-Managed Editions for full data autonomy and powerful insights. Start your analytics journey today!,Empower Your Analytics with Self-Managed Editions,Dive into OWOX's Self-Managed Editions and unlock full control over your data. Let's elevate your data journey together!
/docs/getting-started/billing/consumption-units/,Consumption Units in OWOX Data Marts,"Learn about Consumption Units, their types, and calculations in OWOX Data Marts for efficient data analytics management.",Understand Consumption Units in OWOX Data Marts,"Discover how Consumption Units work in OWOX Data Marts, their definitions, and how to calculate them for optimal performance in your data analytics."
/docs/getting-started/core-concepts/,Core Concepts of OWOX Data Marts,"Understand the core principles of OWOX Data Marts including Data Mart definitions, sources, storage, and report automation features.",Unlock the Power of OWOX Data Marts,"Explore the fundamentals of OWOX Data Marts and how they streamline data control, access, and reporting for business users."
/docs/getting-started/deployment-guide/digitalocean/,Getting Started with DigitalOcean,Learn how to deploy OWOX Data Marts on DigitalOcean. Step-by-step guide from database setup to deployment updates.,Start Your Journey with DigitalOcean and OWOX Data Marts!,Ready to deploy OWOX Data Marts? Our guide will walk you through everything from creating your database to keeping your app updated!
/docs/getting-started/deployment-guide/environment-variables/,Configuring Environment Variables - OWOX Data Marts,Learn how to set up environment variables for OWOX Data Marts to ensure smooth application performance. Step-by-step guide included.,Master Your Environment Variables with OWOX Data Marts!,Dive into our guide to learn how to effectively configure environment variables for OWOX Data Marts. Your smooth application experience starts here!
/docs/getting-started/deployment-guide/google-cloud-platform/,Deploy OWOX Data Marts on Google Cloud Platform,Learn to deploy OWOX Data Marts using Google Cloud services like Cloud SQL and Cloud Run with easy-to-follow steps.,Master Your OWOX Data Marts Deployment on GCP!,Ready to bring your OWOX Data Marts to life on Google Cloud? This guide walks you through using Cloud SQL and Cloud Run effortlessly!
/docs/getting-started/deployment-guide/local-deployment/,Local Deployment Guide for OWOX Data Marts,"Learn how to deploy OWOX Data Marts locally on macOS, Windows, or Linux with easy npm or Docker instructions.",Easily Deploy OWOX Data Marts Locally!,Ready to run OWOX Data Marts on your computer? Our guide will walk you through using npm or Docker to get started quickly!
/docs/getting-started/deployment-guide/render/,Deploy OWOX Data Marts on Render,"Set up OWOX Data Marts on Render in a few easy steps. Deploy the platform, configure environment variables, and start managing your data marts.",Effortlessly Deploy OWOX Data Marts on Render!,Ready to elevate your data management? Follow our simple guide to deploy OWOX Data Marts on Render in no time!
/docs/getting-started/quick-start/,Quick Start Guide | OWOX Data Marts,Launch OWOX Data Marts quickly! Compare cloud and self-hosted deployment options and pick the fastest path to self-service analytics for your team.,Quick Start with OWOX Data Marts 🚀,Ready to dive into OWOX Data Marts? Discover the easiest ways to deploy and start your self-service analytics journey!
/docs/getting-started/setup-guide/connector-data-mart/,Connector-based Data Mart | OWOX,Learn how to set up a connector-based Data Mart to gather data from various platforms like Facebook and TikTok seamlessly.,Unlock Your Data Potential with Connector-based Data Mart,Ready to collect data effortlessly? Discover how to set up a connector-based Data Mart with OWOX to streamline your data management.
/docs/getting-started/setup-guide/connector-triggers/,Connector Trigger - OWOX Data Marts,Automate data import from an API using the Connector Trigger. Easily schedule updates and keep your data fresh with OWOX Data Marts.,Streamline Your Data with Connector Trigger!,Want fresh data on a schedule? Use the Connector Trigger to automate imports from your platform API and keep your reports updated effortlessly!
/docs/getting-started/setup-guide/extension-data-marts/,Extension Data Marts Setup | OWOX Data Marts,Upgrade your Google Sheets Extension Data Marts to OWOX Data Marts in three steps. Keep current setups and unlock new destinations and Insights.,Take Your Extension Data Marts Further,"Already using the OWOX Reports extension? Connect those Data Marts to OWOX Data Marts and unlock Insights, scheduling, and new destinations!"
/docs/getting-started/setup-guide/insights/,Insights | OWOX Data Marts,"Create reusable, narrative reports with Insights in OWOX Data Marts. Embed SQL-backed data in Markdown and deliver ready-to-read analyses.",Turn Data Marts into Narrative Insights,"Insights blend Markdown with live SQL results, turning your Data Marts into ready-to-read reports you can schedule and share. See how!"
/docs/getting-started/setup-guide/joinable-data-marts/,Joinable Data Marts | OWOX Data Marts,"Join fields from multiple Data Marts in one report — no SQL needed. Define relationships, control aggregation, and build cross-source reports.",Join Data Marts Without Writing SQL,"Blend ad spend, orders, and more from different Data Marts in a single report. Define the join once, reuse it everywhere. Learn how!"
/docs/getting-started/setup-guide/mcp/,MCP Server | OWOX Data Marts,"Connect Claude, ChatGPT, and other AI assistants to OWOX Data Marts via the MCP server with OAuth. Explore your data marts in plain language.",Talk to Your Data Marts with AI,"Plug OWOX Data Marts into Claude or ChatGPT via MCP and explore your data marts in plain language — secure OAuth, no tokens to copy!"
/docs/getting-started/setup-guide/members-management/better-auth/,Better Auth: User Management Simplified,Discover how Better Auth enhances identity management with role-based access control and user administration features.,Better Auth: Empower Your User Management,Explore the power of Better Auth for efficient user management! Learn about role-based access control and invite users with ease.
/docs/getting-started/setup-guide/output-controls/,Report Output Controls | OWOX Data Marts,"Filter, slice, sort, and limit the rows a report delivers — no SQL and no changes to the Data Mart. Configure output controls per report.",Control Exactly What Your Reports Deliver,"Filters, slices, sort, and limits — shape each report's output at query time without touching the underlying Data Mart. See how it works!"
/docs/getting-started/setup-guide/pattern-data-mart/,Pattern-based Data Mart | OWOX,Discover how to create a pattern-based Data Mart and unify your data across multiple tables effortlessly with OWOX.,Unlock Your Data Potential with Pattern-based Data Mart,Ready to simplify data management? Learn how to create a pattern-based Data Mart and unify your data across tables effortlessly with OWOX!
/docs/getting-started/setup-guide/report-aggregations/,Report Aggregations & Totals | OWOX Data Marts,"Group, aggregate, and total Data Mart data directly in reports. Server-side GROUP BY across BigQuery, Athena, Snowflake, Redshift, Databricks.",Aggregate Reports Without Writing SQL,"SUM, COUNT, percentiles, date bucketing, and grand totals — build compact aggregated reports right in OWOX Data Marts. No SQL required!"
/docs/getting-started/setup-guide/report-triggers/,Report Trigger Setup | OWOX Data Marts,"Automate your SQL-based, table, or view Data Mart refreshes. Keep Google Sheets and Looker Studio reports always up-to-date effortlessly.",Boost Your Reporting with OWOX Report Triggers,Discover how to set up report triggers to automatically refresh your Data Mart results for seamless updates in Google Sheets and Looker Studio.
/docs/getting-started/setup-guide/sql-data-mart/,SQL-based Data Mart | OWOX,Learn how to create a SQL-based Data Mart with step-by-step guidance to enhance your data analysis and reporting.,Create Your SQL-based Data Mart with OWOX,Discover how easy it is to set up a SQL-based Data Mart! Follow our guide for powerful data analysis and reporting capabilities.
/docs/getting-started/setup-guide/table-data-mart/,Table-based Data Mart Setup Guide,"Learn how to create a Table-based Data Mart for your data warehouse, optimize for reporting, and manage destinations with ease.",Unlock the Power of Table-based Data Marts!,Ready to streamline your data reporting? Discover our guide to setting up a Table-based Data Mart and manage destinations effortlessly!
/docs/getting-started/setup-guide/view-data-mart/,View-based Data Mart | OWOX,Learn how to create a view-based Data Mart that references existing views in your data warehouse. Streamline your data management effortlessly!,Discover Efficient View-based Data Mart Solutions,Ready to optimize your data management? Learn how to set up a view-based Data Mart that directly references your existing views. Let's dive in!
/docs/notifications/email/,Email Notifications | OWOX Data Marts,"Get batched email notifications about failed or successful Data Mart runs in OWOX Data Marts. Learn triggers, email content, and configuration.",Never Miss a Failed Data Mart Run,"Email notifications keep your team on top of Data Mart runs — batched summaries, clear error details, easy setup. Configure yours!"
/docs/notifications/notification-settings/,Notification Settings | OWOX Data Marts,"Configure when and how your team is notified about Data Mart runs — email, webhooks, receivers, and grouping delay, per notification type.",Fine-Tune Your Data Mart Notifications,"Choose receivers, toggle failed or successful run alerts, and set grouping delays — all from Notification Settings in OWOX Data Marts!"
/docs/notifications/webhooks/,Webhooks | OWOX Data Marts,"Receive real-time HTTP notifications when Data Mart runs succeed or fail. Set up webhook URLs, review payloads, and allowlist the OWOX IP.",Wire Data Mart Events into Your Stack,"Webhooks push run events to your endpoint as JSON in real time — perfect for alerting, logging, and automations. Set one up in minutes!"
/docs/project/contexts/,Contexts | OWOX Data Marts,"Group Data Marts, Storages, and Destinations by business domain with Contexts, and scope member visibility in OWOX Data Marts projects.",Organize Your Project with Contexts,"Marketing, Finance, Sales — label resources by business domain and control exactly which members see them. Learn how Contexts work!"
