pagePath,metaTitle,metaDescription,ogTitle,ogDescription
/docs/project/members/,Managing Project Members | OWOX Data Marts,"Invite, manage, and remove project members in OWOX Data Marts. Configure user provisioning and default roles for your organization's projects.",Manage Your OWOX Data Marts Team,"Invites, roles, and automatic user provisioning — everything Project Admins need to manage members in OWOX Data Marts!"
/docs/project/ownership-and-sharing/,Ownership and Sharing | OWOX Data Marts,"Understand how roles, ownership status, and sharing settings combine to control access to Data Marts, Storages, and Destinations in OWOX.",Who Can Do What: Ownership & Sharing,"Roles, owners, and sharing toggles combine into a clear, additive permission model. Master resource-level access in OWOX Data Marts!"
/docs/project/roles-and-permissions/,Roles and Permissions | OWOX Data Marts,"Compare the Project Admin, Technical User, and Business User roles in OWOX Data Marts and see exactly what each role can do in your project.",Pick the Right Role for Every Member,"Admins build the team, Technical Users build the data, Business Users self-serve reports. See the full permission breakdown!"
/docs/storages/manage-storages/,Storage Management | OWOX Data Marts,Manage your data sources with OWOX Data Marts. Learn how to add or remove storage and ensure data control efficiently.,Easily Manage Your Data with OWOX Storage Solutions,Join us and discover how to effortlessly manage your data sources! Learn to add or remove storage and keep full control of your data.
/docs/storages/supported-storages/aws-athena/,Configure AWS Athena in OWOX Data Marts,Learn how to seamlessly set up AWS Athena as a storage option in OWOX Data Marts for smooth analytics.,Easily Configure AWS Athena in OWOX Data Marts!,Dive into our guide to set up AWS Athena as your go-to storage solution in OWOX Data Marts for effortless data analysis.
/docs/storages/supported-storages/aws-redshift/,AWS Redshift Storage | OWOX Data Marts,"Configure AWS Redshift as a storage in OWOX Data Marts. Step-by-step setup covering regions, authentication, validation, and deployment types.",Connect AWS Redshift to OWOX Data Marts,"Serverless or provisioned, IAM or password auth — follow the guide to plug Redshift into OWOX Data Marts and start building Data Marts!"
/docs/storages/supported-storages/databricks/,Databricks Storage | OWOX Data Marts,"Connect your Databricks workspace to OWOX Data Marts. Use SQL warehouses, Unity Catalog, and Delta Lake to power governed, reusable data marts.",Bring Your Lakehouse to OWOX Data Marts,"Connect Databricks in minutes — SQL warehouses for speed, Unity Catalog for governance, Delta Lake for reliability. Here's the guide!"
/docs/storages/supported-storages/google-bigquery-used-in-owox-extension/,BigQuery Extension Storage | OWOX Data Marts,Learn about the system storage created for Data Marts from the OWOX Reports Google Sheets extension and finish its one-time BigQuery setup.,Finish Setting Up Your Extension Storage,See extension Data Marts stuck in Draft? Complete the one-time BigQuery access setup and publish them in the web interface!
/docs/storages/supported-storages/google-bigquery/,Google BigQuery Setup Guide | OWOX Data Marts,Learn how to configure Google BigQuery in OWOX Data Marts with our easy step-by-step guide. Start optimizing your data management today!,Unlock the Power of Data with Google BigQuery!,Ready to optimize your data management? Our guide will help you set up Google BigQuery in OWOX Data Marts in just a few simple steps!
/docs/storages/supported-storages/snowflake/,OWOX Data Marts - Snowflake Setup,Learn how to configure Snowflake storage for OWOX Data Marts. Step-by-step guide from setup to troubleshooting.,Easily Set Up Your Snowflake Storage with OWOX Data Marts,Ready to configure Snowflake storage? Follow our step-by-step guide and troubleshoot like a pro with OWOX Data Marts!
/docs/templates/ga4bigquery/define-ga4-pageviews/,GA4 Pageviews Data Mart | SQL Template,"Define GA4 pageviews in BigQuery with a reusable SQL Data Mart: one row per pageview, with page details, engagement time, and landing flags.",One Row Per Pageview: GA4 SQL Template,Stop redefining pageviews in every dashboard. This reusable SQL Data Mart standardizes GA4 pageview logic in BigQuery. Copy it!
/docs/templates/ga4bigquery/define-ga4-sessions/,GA4 Sessions Data Mart | SQL Template,"Sessionize GA4 BigQuery export data with a reusable SQL Data Mart: one row per session with traffic source, landing page, device, and geo.",One Row Per Session: GA4 SQL Template,"Build GA4 sessions once, reuse everywhere. This SQL template turns raw events into a clean sessions Data Mart in BigQuery. Grab it!"
/docs/templates/ga4bigquery/define-ga4-visitors/,GA4 Visitors Data Mart | SQL Template,"Define GA4 visitors in BigQuery with a reusable SQL Data Mart: one row per visitor with identifiers, first and last seen dates, event counts.",One Row Per Visitor: GA4 SQL Template,"Centralize your GA4 visitor logic with one reusable SQL Data Mart in BigQuery — identifiers, first and last seen, and totals. Copy it!"
/docs/templates/ga4bigquery/ga4-bigquery-channel-grouping/,GA4 Custom Channel Grouping | SQL Template,Define GA4 traffic sources and custom channel grouping in BigQuery by your own rules — one documented source of truth for every report.,"Channel Grouping by Your Rules, Not GA4's","End the 'is LinkedIn paid or social?' debates. This BigQuery Data Mart makes your channel logic explicit, documented, and reusable!"
/license/,OWOX Data Marts License,"Discover the dual-license model for OWOX Data Marts, including MIT and ELv2 licenses for connectors and platform.",Understanding OWOX Data Marts License,"Learn about the dual-license approach for OWOX Data Marts, covering both MIT and ELv2 licensing for better clarity."
/licenses/ee/,OWOX Enterprise License Overview,Discover the terms and rights of using the OWOX Enterprise License for your software needs. Get all essential details here.,Unlock Your Potential with OWOX Enterprise License!,Explore the OWOX Enterprise License to understand your rights and the terms of usage. Dive into the details you need for success!
/licenses/elasticv2/,Elastic License 2.0 Overview,"Explore the key aspects of the Elastic License 2.0 that governs usage, rights, and limitations for software users.",Discover the Elastic License 2.0,"Curious about the Elastic License 2.0? Dive into its essential terms, rights, and limitations for software usage!"
/licenses/mit/,MIT License - OWOX Data Marts,Explore the MIT License terms for OWOX Data Marts. Understand your rights and responsibilities when using our software.,Understand the MIT License for OWOX Data Marts,Dive into the MIT License for OWOX Data Marts! Discover your rights and obligations while using our software seamlessly.
/packages/api-client/readme/,@owox/api-client Package | OWOX Data Marts,TypeScript/JavaScript client for the OWOX Data Marts API. Install @owox/api-client and integrate data marts into your scripts and tools.,The Official OWOX Data Marts API Client,"Typed methods, simple auth, one npm install away — build custom integrations on the OWOX Data Marts API with @owox/api-client!"
/packages/connectors/contributing/,Developer Guide for Data Source Integrations,Explore our Developer Guide to seamlessly integrate custom data sources with OWOX Data Marts. Get started today!,Transform Your Data Connection Experience!,Dive into our Developer Guide and learn how to easily integrate custom data sources into OWOX Data Marts. Let's enhance your data journey!
/packages/connectors/creating-connector/,Create a New Data Source - OWOX,Follow our guide to create a new data source with OWOX Data Marts effortlessly. Start connecting your data today!,Create Your New Data Source with OWOX!,Ready to set up a new data source? Dive into our easy-to-follow guide to get started with OWOX Data Marts and enhance your data connectivity!
/packages/connectors/publishing/,Automated Publishing | OWOX Data Marts,Discover the seamless automated publishing process for OWOX Data Marts connectors. Learn how to publish your packages efficiently.,Streamline Your Publishing with OWOX Data Marts!,Ready to streamline your publishing? Explore our automated process for OWOX Data Marts connectors and make your life easier!
/packages/connectors/src/sources/bank-of-canada/getting-started/,Import Data from Bank of Canada,Learn how to efficiently import data from the Bank of Canada into OWOX Data Marts with this step-by-step guide.,Effortlessly Import Data from Bank of Canada,Discover the easy steps to import data from the Bank of Canada into OWOX Data Marts. Get started with our comprehensive guide today!
/packages/connectors/src/sources/bank-of-canada/readme/,Bank of Canada Data Source,"Transfer official exchange rates from the Bank of Canada into your data warehouse with the OWOX Data Marts connector. Quick, open-source setup.",Unlock Exchange Rates with the Bank of Canada Source!,Ready to start? Our guide will help you effortlessly transfer exchange rates from the Bank of Canada. Let's get started!
/packages/connectors/src/sources/criteo-ads/credentials/,Obtain Criteo Source Credentials - OWOX,Learn how to easily create an app and secure your credentials for the Criteo source with our step-by-step guide.,Unlock Your Criteo Source Credentials with Ease!,Get the help you need to create an app and obtain your Criteo source credentials effortlessly. Follow our guide for a smooth process!
/packages/connectors/src/sources/criteo-ads/getting-started/,Import Data from Criteo Ads,Learn how to seamlessly import data from Criteo Ads into OWOX Data Marts with this comprehensive guide.,Easily Import Data from Criteo Ads!,Dive into our step-by-step guide and discover how to efficiently import data from Criteo Ads into OWOX Data Marts.
/packages/connectors/src/sources/criteo-ads/readme/,Criteo Source | OWOX Data Marts,Transfer raw Criteo advertising data into your data warehouse for analysis with the open-source OWOX Data Marts connector. Start with our guide.,Unlock Insights with Criteo Source | OWOX Data Marts,Ready to dive into Criteo data? Our guide makes transferring and analyzing raw data a breeze!
/packages/connectors/src/sources/facebook-marketing/credentials/,Obtain Facebook Ads Access Token - OWOX,Learn step-by-step how to obtain your Facebook Ads access token and start importing data seamlessly with OWOX Data Marts.,Unlock Your Facebook Ads Access Token with Ease!,Ready to start importing data? Follow our easy guide to obtain your Facebook Ads access token — let’s get you connected with OWOX Data Marts!
/packages/connectors/src/sources/facebook-marketing/endpoints-and-fields/,Facebook Ads Endpoints & Fields | OWOX,"Browse all supported Facebook Marketing endpoints and fields in the OWOX Data Marts connector — insights, breakdowns, ads, and creatives.","Every Facebook Ads Endpoint, One Page","Spend, reach, breakdowns, creatives — find the right Facebook Marketing endpoint and fields for your reporting needs in one reference!"
/packages/connectors/src/sources/facebook-marketing/getting-started/,Import Data from Facebook Ads | OWOX,Learn how to import Facebook Ads data efficiently with OWOX. Follow our easy steps to set up your data mart and start analyzing today!,Effortlessly Import Facebook Ads Data with OWOX,Dive into our guide on importing Facebook Ads data. Step-by-step instructions await to set up your data mart and unlock insightful analytics!
/packages/connectors/src/sources/facebook-marketing/readme/,Facebook Ads Source | OWOX,Transfer raw data from Meta advertising services for deep analysis and reporting with the Facebook Ads Source by OWOX.,Unlock the Power of Facebook Ads Data,Dive deep into your advertising performance by transferring raw data from Meta services. Start your analysis journey with our easy guide!
/packages/connectors/src/sources/facebook-marketing/troubleshooting/,Facebook Ads Troubleshooting | OWOX Data Marts,"Fix Facebook Ads import errors in OWOX Data Marts: quick checks, common Meta API errors, rate limits, permissions, and backfill tips.",Fix Your Facebook Ads Imports Fast,"Run failed? Match the error against common Meta API cases — tokens, permissions, rate limits, backfills — and get back on track!"
/packages/connectors/src/sources/git-hub/getting-started/,Import Data from GitHub Source,Learn how to seamlessly import data from the GitHub source using OWOX Data Marts. Step-by-step guide included!,Easily Import Data from GitHub Source,"Ready to bring data from GitHub to your OWOX Data Marts? Check out our simple, step-by-step guide for a smooth import experience!"
/packages/connectors/src/sources/git-hub/readme/,GitHub Source for OWOX Data Marts,Explore how to export GitHub stars and contributors data effortlessly with the OWOX Data Marts GitHub Source.,Unlock GitHub Data with OWOX Data Marts!,Discover the ease of exporting stars and contributors data from GitHub using the OWOX Data Marts GitHub Source. Get started today!
/packages/connectors/src/sources/google-ads/credentials/,Access Token for Google Ads Source,Learn how to obtain the access token for Google Ads Source using OWOX Data Marts to access and import your advertising data.,Unlock Google Ads Data: Get Your Access Token Today!,Ready to connect to Google Ads? Discover the steps to retrieve your access token effortlessly with OWOX Data Marts and succeed in your marketing efforts!
/packages/connectors/src/sources/google-ads/getting-started/,Import Data from Google Ads | OWOX,Learn how to seamlessly import data from Google Ads into OWOX Data Marts with our step-by-step guide.,Effortlessly Import Data from Google Ads with OWOX!,Dive into our easy guide on importing data from Google Ads into OWOX Data Marts. Get started today and streamline your data management!
/packages/connectors/src/sources/google-ads/readme/,Google Ads Source | OWOX Data Marts,Transfer raw data from Google Ads for in-depth analysis and reporting. Get started with our easy setup guide!,Unlock Insights with Google Ads Source | OWOX Data Marts,Start transferring your Google Ads data effortlessly! Dive into our setup guide for quick and in-depth analysis and reporting.
/packages/connectors/src/sources/linked-in-ads/credentials/,Obtain Refresh Token for LinkedIn Ads,Step-by-step guide to generating a Refresh Token for LinkedIn Ads API access. Get started with your LinkedIn Ads integration now!,Unlock LinkedIn Ads: Get Your Refresh Token!,Need to connect to LinkedIn Ads? Follow our easy steps to generate your Refresh Token and start accessing your advertising data seamlessly!
/packages/connectors/src/sources/linked-in-ads/getting-started/,Import Data from LinkedIn Ads | OWOX Data Marts,Learn how to effectively import data from LinkedIn Ads into OWOX Data Marts with this step-by-step guide.,Master the Art of Importing LinkedIn Ads Data!,Ready to harness the power of LinkedIn Ads data? Check out this easy-to-follow guide to import your data into OWOX Data Marts!
/packages/connectors/src/sources/linked-in-ads/readme/,LinkedIn Ads Source - OWOX Data Marts,Easily export and analyze LinkedIn Ads data to enhance your marketing strategies. Get started with our step-by-step guide!,Unlock LinkedIn Ads Data with OWOX!,Ready to elevate your marketing? Seamlessly export LinkedIn Ads data for deep analysis and reporting. Let's get started with our easy guide!
/packages/connectors/src/sources/linked-in-pages/credentials/,Obtain LinkedIn Pages Access Token | OWOX Data,Learn how to easily obtain the Access Token for LinkedIn Pages. Follow our step-by-step guide to connect your app seamlessly.,Unlock LinkedIn Pages Access Token with Ease!,"Ready to connect to LinkedIn Pages? Our simple, step-by-step guide will help you obtain your Access Token in no time!"
/packages/connectors/src/sources/linked-in-pages/getting-started/,Import Data from LinkedIn Pages - OWOX,Learn how to import data from LinkedIn Pages seamlessly with OWOX Data Marts. Step-by-step guide for easy setup!,Easily Import Data from LinkedIn Pages with OWOX!,Ready to streamline your data import process? Discover how to effortlessly import data from LinkedIn Pages using OWOX Data Marts in our step-by-step guide!
/packages/connectors/src/sources/linked-in-pages/readme/,LinkedIn Pages Source | OWOX Data Marts,Seamlessly export and analyze your LinkedIn Pages data for marketing insights. Start using the LinkedIn Pages Source today!,Unlock Insights with LinkedIn Pages Source!,Ready to dive into your LinkedIn Pages data? Discover how to export and analyze data for powerful marketing insights with our LinkedIn Pages Source.
/packages/connectors/src/sources/microsoft-ads/credentials/,Obtain Microsoft Ads Credentials,Learn to acquire necessary credentials for Microsoft Ads with our step-by-step guide. Get started today!,Unlock Your Microsoft Ads Potential!,Ready to supercharge your advertising? Discover how to obtain your Microsoft Ads credentials with our easy guide!
/packages/connectors/src/sources/microsoft-ads/getting-started/,Import Data from Microsoft Ads,Learn how to efficiently import data from Microsoft Ads into OWOX Data Marts with our step-by-step guide.,Seamlessly Import Data from Microsoft Ads,Unlock the potential of your data! Follow our easy steps to import data from Microsoft Ads into OWOX Data Marts. Let's get started!
/packages/connectors/src/sources/microsoft-ads/readme/,Microsoft Ads Source | OWOX Data Marts,Export raw data from Microsoft Ads for custom analysis and reporting with ease using OWOX Data Marts.,Unlock Insights with Microsoft Ads Source,Discover how to seamlessly export data from Microsoft Ads for tailored analysis and impactful reporting with OWOX Data Marts!
/packages/connectors/src/sources/open-exchange-rates/credentials/,Obtain App ID for Open Exchange Rates,Learn how to easily obtain your App ID for Open Exchange Rates with our step-by-step guide. Get started today!,Unlock Your App ID for Open Exchange Rates!,Ready to use Open Exchange Rates? Follow our simple steps to obtain your App ID and get started with ease!
/packages/connectors/src/sources/open-exchange-rates/getting-started/,Import Data from Open Exchange Rates,Learn to easily import data from Open Exchange Rates into OWOX Data Marts with our step-by-step guide.,Unlock Data Insights: Import from Open Exchange Rates,"Discover how simple it is to import data from Open Exchange Rates into OWOX Data Marts. Follow our clear, step-by-step instructions!"
/packages/connectors/src/sources/open-exchange-rates/readme/,Open Exchange Rates Source | OWOX,"Easily transfer currency data with Open Exchange Rates. Discover the setup guide, credentials, and support easily.",Unlock Data with Open Exchange Rates Source!,Ready to streamline your currency data transfer? Check out our guide on getting started with Open Exchange Rates and get support whenever you need it!
/packages/connectors/src/sources/open-holidays/getting-started/,Import Data from Open Holidays Source,Learn how to easily import holiday data using OWOX Data Marts. Step-by-step guide for setup and execution.,Seamlessly Import Holiday Data with OWOX!,Discover how to effortlessly import holiday data with our step-by-step guide. Get started with OWOX Data Marts today!
/packages/connectors/src/sources/open-holidays/readme/,Open Holidays Source | OWOX Data Marts,Discover how the Open Holidays Source provides public and school holiday data. Get the setup guide to get started quickly!,Unlock the Power of Holiday Data with Open Holidays Source,Ready to dive into holiday data? The Open Holidays Source helps you access public and school holidays effortlessly. Check out our setup guide!
/packages/connectors/src/sources/reddit-ads/credentials/,Reddit Ads Credentials Guide,Learn how to obtain Reddit Ads API credentials in just a few steps and connect your advertising data to OWOX Data Marts for reporting.,Get Your Reddit Ads Credentials with Ease!,Follow this simple guide to obtain your Reddit Ads source credentials and start importing data effortlessly!
/packages/connectors/src/sources/reddit-ads/getting-started/,Import Data from Reddit Ads,Learn to import data from the Reddit Ads Source using OWOX Data Marts. Quick and effective steps to access your data.,Easily Import Data from Reddit Ads Now!,Discover how to effortlessly import data from the Reddit Ads Source with OWOX Data Marts. Access your valuable data in just a few steps!
/packages/connectors/src/sources/reddit-ads/readme/,Reddit Ads Source | OWOX Data Marts,Easily export data from Reddit Ads for analysis and reporting. Start your journey with our comprehensive guide!,Unlock Reddit Ads Data with OWOX!,Ready to dive into Reddit Ads? Easily export data for custom analysis and reporting with our step-by-step guide. Let's get started!
/packages/connectors/src/sources/shopify/credentials/,Shopify Credentials Guide | OWOX Data Marts,Create a Shopify app and obtain the Admin API Access Token required to import Shopify data into OWOX Data Marts. A complete walkthrough.,Get Your Shopify API Credentials,"Everything you need to create a Shopify app, select scopes, and grab the Admin API token for your OWOX Data Marts connector!"
/packages/connectors/src/sources/shopify/getting-started/,Shopify Import Guide | OWOX Data Marts,"Step-by-step guide to importing Shopify data with OWOX Data Marts: create a Data Mart, configure the connector, and load data to your storage.",Import Shopify Data in Minutes,From access token to loaded warehouse tables — follow the walkthrough to set up your Shopify connector in OWOX Data Marts!
/packages/connectors/src/sources/shopify/readme/,Shopify Source | OWOX Data Marts,"Import raw Shopify business data into your data warehouse with the OWOX Data Marts Shopify connector. Free, open-source, and easy to set up.",Pull Shopify Data into Your Warehouse,The Shopify source brings raw store data into your warehouse for deep analysis and reporting — free and open-source. Get started!
/packages/connectors/src/sources/tik-tok-ads/credentials/,Obtain TikTok Ads Access Token,Learn how to swiftly obtain an access token for TikTok Ads API and seamlessly integrate your advertising data.,Unlock Your TikTok Ads Potential!,Ready to tap into TikTok Ads? Discover how to easily obtain your access token and elevate your advertising strategy!
/packages/connectors/src/sources/tik-tok-ads/getting-started/,Import TikTok Ads Data | OWOX Data Marts,Learn how to seamlessly import data from TikTok Ads into OWOX Data Marts with our step-by-step guide.,Easily Import Your TikTok Ads Data,Want to import your TikTok Ads data? Our guide walks you through the process step by step. Start making data-driven decisions today!
/packages/connectors/src/sources/tik-tok-ads/readme/,TikTok Ads Source | OWOX Data Marts,Unlock the potential of TikTok Ads data for analysis and reporting with OWOX Data Marts. Get started now!,Transform Your Data with TikTok Ads Source!,Ready to dive into TikTok Ads? Discover how to harness this data for insightful analysis and reporting with OWOX Data Marts!
/packages/connectors/src/sources/xads/credentials/,Obtain X Ads Credentials - Quick Guide,Learn how to easily generate and manage your X Ads API credentials with our step-by-step guide. Start optimizing your ad data today!,Unlock Your X Ads Potential with Easy Credential Setup!,"Ready to leverage X Ads? Follow our simple guide to generate and manage your API credentials effortlessly, boosting your ad optimization efforts!"
/packages/connectors/src/sources/xads/getting-started/,Import Data from X Ads Source - OWOX,Learn how to import advertising data from the X Ads source into OWOX Data Marts with our step-by-step guide — from credentials to loaded tables.,Unlock Your Data Potential: Import from X Ads Source,Ready to leverage your data? Discover how to effortlessly import data from X Ads Source into OWOX Data Marts with this simple guide.
/packages/connectors/src/sources/xads/readme/,X Ads Source - Data Integration,Seamlessly export raw data from X Ads for analysis and reporting. Get started with our step-by-step guide!,Unlock the Power of X Ads Data Integration!,Ready to dive into X Ads? Seamlessly export raw data for your custom analysis and boost your marketing with our easy guide!
/packages/connectors/src/storages/aws-athena/readme/,AWS Athena Storage | OWOX Data Marts,Discover AWS Athena Storage with OWOX Data Marts for seamless data management. Integrate effortlessly and start optimizing your data processes.,Unlock the Power of AWS Athena Storage with OWOX,Join us at OWOX Data Marts and discover how AWS Athena Storage can enhance your data management and integration experience!
/packages/connectors/src/storages/aws-redshift/readme/,AWS Redshift Connector | OWOX Data Marts,Storage connector for AWS Redshift via the Redshift Data API. Supports Serverless and Provisioned clusters with three authentication methods.,Redshift Storage Connector Internals,"Data API-based, serverless-ready, three auth methods — explore how the AWS Redshift storage connector works in OWOX Data Marts!"
/packages/connectors/src/storages/google-big-query/readme/,Google BigQuery Storage | OWOX Data Marts,Discover the Google BigQuery Storage with OWOX Data Marts. Easily manage your data storage and solutions tailored for Node.js and Apps Script.,Unlock the Power of Google BigQuery Storage with OWOX!,Explore how OWOX Data Marts can simplify your Google BigQuery Storage needs. Perfect for Node.js and Apps Script integrations!
