pagePath,metaTitle,metaDescription,ogTitle,ogDescription
/packages/eslint-config/readme/,@owox/eslint-config | OWOX Data Marts,Explore the shared ESLint configuration for the OWOX workspace. Simplify your JavaScript linting and maintain code quality effortlessly.,Unlock Cleaner Code with @owox/eslint-config!,Dive into the shared ESLint configuration for OWOX. Make your JavaScript linting a breeze and keep your codebase clean!
/packages/idp-better-auth/readme/,@owox/idp-better-auth | Secure User Management,Discover how to set up the Better Auth IDP for OWOX Data Marts. Manage users effortlessly and secure your application.,Unlock Seamless User Management with OWOX Better Auth,Dive into the Better Auth IDP for OWOX Data Marts! Set up user management effortlessly and enhance your application's security.
/packages/idp-owox-better-auth/readme/,OWOX Better Auth IDP | OWOX Data Marts,Set up the @owox/idp-owox-better-auth provider for OWOX Data Marts authentication: environment configuration and step-by-step setup.,Configure Better Auth for OWOX,"A quick setup guide for the OWOX Better Auth identity provider — env vars, configuration, and everything to get auth running!"
/packages/idp-protocol/readme/,@owox/idp-protocol | OWOX Data Marts,"Discover the OWOX IDP Protocol for seamless authentication and authorization in data marts. Explore features, setup, and usage examples today!",Unlock Seamless Authentication with OWOX IDP Protocol,Dive into the OWOX IDP Protocol and learn how to enhance your data mart authentication. Check out features and practical examples to get started!
/packages/internal-helpers/readme/,@owox/internal-helpers: Core Functions,Discover internal helpers used by OWOX's core packages. Improve your integration with essential tools and functions.,Unlock the Power of OWOX Internal Helpers!,Explore the internal helpers for OWOX's core packages. These tools are vital for enhancing your integration and efficiency.
/packages/internal-helpers/src/integrations/email/readme/,Email Integration Helper | OWOX Data Marts,"Email sending abstraction for OWOX Data Marts with SendGrid support and a noop fallback. Supported providers, configuration, and usage examples.",How OWOX Sends Email,"SendGrid or noop — a look at the minimal email integration helper used across OWOX Data Marts, with usage examples."
/packages/internal-helpers/src/integrations/event-bus/readme/,Event Bus Integration | OWOX Data Marts,"A minimal fan-out event bus for OWOX Data Marts integrations: isolated transports, environment configuration, and delivery behavior.",Inside the OWOX Event Bus,"One event, many transports, zero cross-failures — how the minimal event bus powers integrations in OWOX Data Marts."
/packages/prettier-config/readme/,@owox/prettier-config | OWOX Data Marts,Discover OWOX's shared Prettier configuration for your projects—ensuring consistency and quality in your code formatting.,Enhance Your Projects with OWOX's Prettier Config!,Explore how OWOX's shared Prettier configuration can help keep your code clean and consistent across all your projects!
/packages/test-utils/readme/,@owox/test-utils Package | OWOX Data Marts,"Shared test utilities for OWOX Data Marts: bootstrap the NestJS app, build test data payloads, and set up common prerequisite chains.",Shared Test Utilities for OWOX,"Bootstrap helpers, payload builders, prerequisite chains — the @owox/test-utils package that powers OWOX Data Marts tests."
/packages/typescript-config/readme/,@owox/typescript-config - OWOX Data Marts,"Discover the shared TypeScript configuration for OWOX Data Marts, enhancing your workspace setup with efficiency.",Boost Your Workspace with @owox/typescript-config,Explore how @owox/typescript-config can streamline your OWOX Data Marts workspace setup for maximum efficiency!
